{
  "registry_type": "global_impact_indicator_registry",
  "registry_version": "1.4.0",
  "workspace_id": "gic-workspace-bdc75d8b68333af2",
  "generated_at": "2026-07-17T19:50:09.888514+00:00",
  "units": [
    {
      "unit_id": "gic-unit-hectare",
      "workspace_id": null,
      "code": "ha",
      "symbol": "ha",
      "name": "Hectare",
      "dimension": "area",
      "canonical_unit_id": "gic-unit-square-metre",
      "scale_to_canonical": 10000.0,
      "offset_to_canonical": 0.0,
      "precision_digits": 3,
      "lifecycle_status": "active",
      "revision": 1,
      "created_at": "2026-07-17T19:50:09.872782+00:00",
      "updated_at": "2026-07-17T19:50:09.872782+00:00",
      "metadata": {
        "registry_version": "1.4.0",
        "standard": true
      }
    },
    {
      "unit_id": "gic-unit-square-metre",
      "workspace_id": null,
      "code": "m2",
      "symbol": "m²",
      "name": "Square metre",
      "dimension": "area",
      "canonical_unit_id": "gic-unit-square-metre",
      "scale_to_canonical": 1.0,
      "offset_to_canonical": 0.0,
      "precision_digits": 3,
      "lifecycle_status": "active",
      "revision": 1,
      "created_at": "2026-07-17T19:50:09.872782+00:00",
      "updated_at": "2026-07-17T19:50:09.872782+00:00",
      "metadata": {
        "registry_version": "1.4.0",
        "standard": true
      }
    },
    {
      "unit_id": "gic-unit-count",
      "workspace_id": null,
      "code": "count",
      "symbol": "",
      "name": "Count",
      "dimension": "count",
      "canonical_unit_id": "gic-unit-count",
      "scale_to_canonical": 1.0,
      "offset_to_canonical": 0.0,
      "precision_digits": 0,
      "lifecycle_status": "active",
      "revision": 1,
      "created_at": "2026-07-17T19:50:09.872782+00:00",
      "updated_at": "2026-07-17T19:50:09.872782+00:00",
      "metadata": {
        "registry_version": "1.4.0",
        "standard": true
      }
    },
    {
      "unit_id": "gic-unit-usd",
      "workspace_id": null,
      "code": "USD",
      "symbol": "$",
      "name": "US dollar",
      "dimension": "currency_usd",
      "canonical_unit_id": "gic-unit-usd",
      "scale_to_canonical": 1.0,
      "offset_to_canonical": 0.0,
      "precision_digits": 2,
      "lifecycle_status": "active",
      "revision": 1,
      "created_at": "2026-07-17T19:50:09.872782+00:00",
      "updated_at": "2026-07-17T19:50:09.872782+00:00",
      "metadata": {
        "registry_version": "1.4.0",
        "standard": true
      }
    },
    {
      "unit_id": "gic-unit-percent",
      "workspace_id": null,
      "code": "%",
      "symbol": "%",
      "name": "Percent",
      "dimension": "dimensionless",
      "canonical_unit_id": "gic-unit-ratio",
      "scale_to_canonical": 0.01,
      "offset_to_canonical": 0.0,
      "precision_digits": 2,
      "lifecycle_status": "active",
      "revision": 1,
      "created_at": "2026-07-17T19:50:09.872782+00:00",
      "updated_at": "2026-07-17T19:50:09.872782+00:00",
      "metadata": {
        "registry_version": "1.4.0",
        "standard": true
      }
    },
    {
      "unit_id": "gic-unit-ratio",
      "workspace_id": null,
      "code": "ratio",
      "symbol": "",
      "name": "Ratio",
      "dimension": "dimensionless",
      "canonical_unit_id": "gic-unit-ratio",
      "scale_to_canonical": 1.0,
      "offset_to_canonical": 0.0,
      "precision_digits": 4,
      "lifecycle_status": "active",
      "revision": 1,
      "created_at": "2026-07-17T19:50:09.872782+00:00",
      "updated_at": "2026-07-17T19:50:09.872782+00:00",
      "metadata": {
        "registry_version": "1.4.0",
        "standard": true
      }
    },
    {
      "unit_id": "gic-unit-kgco2e",
      "workspace_id": null,
      "code": "kgCO2e",
      "symbol": "kgCO₂e",
      "name": "Kilogram CO2 equivalent",
      "dimension": "emissions",
      "canonical_unit_id": "gic-unit-kgco2e",
      "scale_to_canonical": 1.0,
      "offset_to_canonical": 0.0,
      "precision_digits": 3,
      "lifecycle_status": "active",
      "revision": 1,
      "created_at": "2026-07-17T19:50:09.872782+00:00",
      "updated_at": "2026-07-17T19:50:09.872782+00:00",
      "metadata": {
        "registry_version": "1.4.0",
        "standard": true
      }
    },
    {
      "unit_id": "gic-unit-tco2e",
      "workspace_id": null,
      "code": "tCO2e",
      "symbol": "tCO₂e",
      "name": "Metric tonne CO2 equivalent",
      "dimension": "emissions",
      "canonical_unit_id": "gic-unit-kgco2e",
      "scale_to_canonical": 1000.0,
      "offset_to_canonical": 0.0,
      "precision_digits": 3,
      "lifecycle_status": "active",
      "revision": 1,
      "created_at": "2026-07-17T19:50:09.872782+00:00",
      "updated_at": "2026-07-17T19:50:09.872782+00:00",
      "metadata": {
        "registry_version": "1.4.0",
        "standard": true
      }
    },
    {
      "unit_id": "gic-unit-mwh",
      "workspace_id": null,
      "code": "MWh",
      "symbol": "MWh",
      "name": "Megawatt hour",
      "dimension": "energy",
      "canonical_unit_id": "gic-unit-kwh",
      "scale_to_canonical": 1000.0,
      "offset_to_canonical": 0.0,
      "precision_digits": 3,
      "lifecycle_status": "active",
      "revision": 1,
      "created_at": "2026-07-17T19:50:09.872782+00:00",
      "updated_at": "2026-07-17T19:50:09.872782+00:00",
      "metadata": {
        "registry_version": "1.4.0",
        "standard": true
      }
    },
    {
      "unit_id": "gic-unit-kwh",
      "workspace_id": null,
      "code": "kWh",
      "symbol": "kWh",
      "name": "Kilowatt hour",
      "dimension": "energy",
      "canonical_unit_id": "gic-unit-kwh",
      "scale_to_canonical": 1.0,
      "offset_to_canonical": 0.0,
      "precision_digits": 3,
      "lifecycle_status": "active",
      "revision": 1,
      "created_at": "2026-07-17T19:50:09.872782+00:00",
      "updated_at": "2026-07-17T19:50:09.872782+00:00",
      "metadata": {
        "registry_version": "1.4.0",
        "standard": true
      }
    },
    {
      "unit_id": "gic-unit-kilometre",
      "workspace_id": null,
      "code": "km",
      "symbol": "km",
      "name": "Kilometre",
      "dimension": "length",
      "canonical_unit_id": "gic-unit-metre",
      "scale_to_canonical": 1000.0,
      "offset_to_canonical": 0.0,
      "precision_digits": 3,
      "lifecycle_status": "active",
      "revision": 1,
      "created_at": "2026-07-17T19:50:09.872782+00:00",
      "updated_at": "2026-07-17T19:50:09.872782+00:00",
      "metadata": {
        "registry_version": "1.4.0",
        "standard": true
      }
    },
    {
      "unit_id": "gic-unit-metre",
      "workspace_id": null,
      "code": "m",
      "symbol": "m",
      "name": "Metre",
      "dimension": "length",
      "canonical_unit_id": "gic-unit-metre",
      "scale_to_canonical": 1.0,
      "offset_to_canonical": 0.0,
      "precision_digits": 3,
      "lifecycle_status": "active",
      "revision": 1,
      "created_at": "2026-07-17T19:50:09.872782+00:00",
      "updated_at": "2026-07-17T19:50:09.872782+00:00",
      "metadata": {
        "registry_version": "1.4.0",
        "standard": true
      }
    },
    {
      "unit_id": "gic-unit-kg",
      "workspace_id": null,
      "code": "kg",
      "symbol": "kg",
      "name": "Kilogram",
      "dimension": "mass",
      "canonical_unit_id": "gic-unit-kg",
      "scale_to_canonical": 1.0,
      "offset_to_canonical": 0.0,
      "precision_digits": 3,
      "lifecycle_status": "active",
      "revision": 1,
      "created_at": "2026-07-17T19:50:09.872782+00:00",
      "updated_at": "2026-07-17T19:50:09.872782+00:00",
      "metadata": {
        "registry_version": "1.4.0",
        "standard": true
      }
    },
    {
      "unit_id": "gic-unit-tonne",
      "workspace_id": null,
      "code": "t",
      "symbol": "t",
      "name": "Metric tonne",
      "dimension": "mass",
      "canonical_unit_id": "gic-unit-kg",
      "scale_to_canonical": 1000.0,
      "offset_to_canonical": 0.0,
      "precision_digits": 3,
      "lifecycle_status": "active",
      "revision": 1,
      "created_at": "2026-07-17T19:50:09.872782+00:00",
      "updated_at": "2026-07-17T19:50:09.872782+00:00",
      "metadata": {
        "registry_version": "1.4.0",
        "standard": true
      }
    },
    {
      "unit_id": "gic-unit-day",
      "workspace_id": null,
      "code": "day",
      "symbol": "d",
      "name": "Day",
      "dimension": "time",
      "canonical_unit_id": "gic-unit-hour",
      "scale_to_canonical": 24.0,
      "offset_to_canonical": 0.0,
      "precision_digits": 2,
      "lifecycle_status": "active",
      "revision": 1,
      "created_at": "2026-07-17T19:50:09.872782+00:00",
      "updated_at": "2026-07-17T19:50:09.872782+00:00",
      "metadata": {
        "registry_version": "1.4.0",
        "standard": true
      }
    },
    {
      "unit_id": "gic-unit-hour",
      "workspace_id": null,
      "code": "hour",
      "symbol": "h",
      "name": "Hour",
      "dimension": "time",
      "canonical_unit_id": "gic-unit-hour",
      "scale_to_canonical": 1.0,
      "offset_to_canonical": 0.0,
      "precision_digits": 2,
      "lifecycle_status": "active",
      "revision": 1,
      "created_at": "2026-07-17T19:50:09.872782+00:00",
      "updated_at": "2026-07-17T19:50:09.872782+00:00",
      "metadata": {
        "registry_version": "1.4.0",
        "standard": true
      }
    },
    {
      "unit_id": "gic-unit-litre",
      "workspace_id": null,
      "code": "L",
      "symbol": "L",
      "name": "Litre",
      "dimension": "volume",
      "canonical_unit_id": "gic-unit-litre",
      "scale_to_canonical": 1.0,
      "offset_to_canonical": 0.0,
      "precision_digits": 3,
      "lifecycle_status": "active",
      "revision": 1,
      "created_at": "2026-07-17T19:50:09.872782+00:00",
      "updated_at": "2026-07-17T19:50:09.872782+00:00",
      "metadata": {
        "registry_version": "1.4.0",